{"actor_map_id":"h2epr.0616.actor-map.v1","actor_map_sha256":"24ca75bf9f537858b9a339d9d0839e2cbb3b67d54d7d2c0b3714e3614bc1bc89","actor_map_version":"1.0.0","event_id":"H2EPR-0616","mappings":[{"disposition":"named_agent","losses":["This interface cannot establish an intrusion start in May 2015, execute malware, choose a target-selection strategy, prove state sponsorship, read private patient data, or determine technical attack success."],"rationale":"P_1 is retained as a disclosed representation gate because Whitefly is named only in retrospective March 2019 material. Its structural actor identity supports two attributed process records; it is not evidence that other 2018 actors knew the attribution.","source_participant_id":"P_1","target_id":"attributed_whitefly_activity_gate"},{"disposition":"named_agent","losses":["SingHealth cannot create the intrusion, verify attacker identity, author IHiS findings, issue government disclosure or penalties, complete patient notification, pay a fine, or prove that reforms were implemented or effective."],"rationale":"P_2 persists across seven appearances as data owner, affected organization, investigated entity and penalty recipient. Passive database ownership, data theft, public naming and investigation subject status do not become choices.","source_participant_id":"P_2","target_id":"singhealth_data_owner"},{"disposition":"named_agent","losses":["IHiS cannot author SingHealth's detection or acceptance, government disclosure, COI findings, PDPC orders, actual fine payment, completed control deployment, or cybersecurity effectiveness."],"rationale":"P_3 consolidates the contracted system operator across six appearances. Historical control failures, failure to detect, cooperation, and receipt of a fine are environment context/results; only supported organizational records are selectable.","source_participant_id":"P_3","target_id":"ihis_system_operator"},{"disposition":"initial_context","losses":["No unanimous patient action, individual trajectory, harm, identity loss, notification receipt or response rate is invented."],"rationale":"P_4 appears three times as the cohort whose records were affected or publicly described. The Draft exposes no cohort-authored response, notification acknowledgement, complaint, care decision or participation distribution.","source_participant_id":"P_4","target_id":"affected_singhealth_patient_context"},{"disposition":"named_agent","losses":["This interface cannot verify breach scope, establish the COI itself, issue penalties, attribute Whitefly, disclose private medication data, or determine investigation results."],"rationale":"P_5 is both a named affected individual and government leader. The parent retains only the public statement/direction exposed by the dataset and does not turn his medical-data targeting into policy authority over other records.","source_participant_id":"P_5","target_id":"prime_minister_response_interface"},{"disposition":"named_agent","losses":["The ministry cannot determine attacker identity, fine an entity, complete technical remediation, prove patient notification, or author findings for the independent committee."],"rationale":"P_6 spans disclosure, inquiry oversight and later reform oversight. Each record remains separate; the ministry does not absorb IHiS operations, COI findings, PDPC penalty authority or Symantec attribution.","source_participant_id":"P_6","target_id":"singapore_ministry_of_health"},{"disposition":"named_agent","losses":["The committee cannot issue PDPC penalties, implement organization controls, prove attacker identity, determine fine payment, or retroactively alter earlier actor knowledge."],"rationale":"P_7 is the named high-level investigative panel in one Draft appearance. The parent separates conducting the inquiry from publishing its public account; it does not synthesize hearings, witnesses or the 453-page report.","source_participant_id":"P_7","target_id":"singhealth_committee_of_inquiry"},{"disposition":"named_agent","losses":["PDPC cannot collect or prove payment, conduct the COI inquiry, implement security controls, attribute the attacker, or collapse IHiS and SingHealth obligations."],"rationale":"P_8 has one Draft appearance and two associated penalty transactions. Separate intents preserve the two amounts and recipients while treating them as orders, not observed transfers.","source_participant_id":"P_8","target_id":"personal_data_protection_commission"},{"disposition":"named_agent","losses":["The publisher cannot prove state sponsorship, rewrite 2018 participant knowledge, issue a legal attribution, impose penalties, or determine the technical attack path."],"rationale":"P_9 owns only the public report record exposed in E8. It remains organizational and does not simulate researchers, telemetry, proprietary evidence or internal attribution confidence.","source_participant_id":"P_9","target_id":"symantec_attribution_publisher"}],"roster_id":"h2epr.0616.roster.v1","runtime_actors":[{"actor_id":"attributed_whitefly_activity_gate","representation_kind":"agent","semantic_parent_id":"h2epr.0616.agent.attributed_whitefly_activity_gate.v1","source_participant_ids":["P_1"]},{"actor_id":"singhealth_data_owner","representation_kind":"agent","semantic_parent_id":"h2epr.0616.agent.singhealth_data_owner.v1","source_participant_ids":["P_2"]},{"actor_id":"ihis_system_operator","representation_kind":"agent","semantic_parent_id":"h2epr.0616.agent.ihis_system_operator.v1","source_participant_ids":["P_3"]},{"actor_id":"prime_minister_response_interface","representation_kind":"agent","semantic_parent_id":"h2epr.0616.agent.prime_minister_response_interface.v1","source_participant_ids":["P_5"]},{"actor_id":"singapore_ministry_of_health","representation_kind":"agent","semantic_parent_id":"h2epr.0616.agent.singapore_ministry_of_health.v1","source_participant_ids":["P_6"]},{"actor_id":"singhealth_committee_of_inquiry","representation_kind":"agent","semantic_parent_id":"h2epr.0616.agent.singhealth_committee_of_inquiry.v1","source_participant_ids":["P_7"]},{"actor_id":"personal_data_protection_commission","representation_kind":"agent","semantic_parent_id":"h2epr.0616.agent.personal_data_protection_commission.v1","source_participant_ids":["P_8"]},{"actor_id":"symantec_attribution_publisher","representation_kind":"agent","semantic_parent_id":"h2epr.0616.agent.symantec_attribution_publisher.v1","source_participant_ids":["P_9"]}],"schema_version":"h2epr.actor-map.v2"}
